{
  "schemaVersion": 1,
  "kind": "evidence-source",
  "id": "github-com-datadog-terraform-module-datadog-agentless-scanner-a1086e9a45",
  "sourceType": "scanner-rule-source",
  "title": "DataDog/terraform-module-datadog-agentless-scanner @ main: azure/arm/agentless-api-call.ps1",
  "publisher": "DataDog/terraform-module-datadog-agentless-scanner",
  "publishedAt": null,
  "locator": {
    "url": "https://github.com/DataDog/terraform-module-datadog-agentless-scanner",
    "pin": {
      "kind": "live-unpinned"
    }
  },
  "observations": [
    {
      "observedAt": "2026-09-22",
      "outcome": "read",
      "observer": "legacy-import",
      "note": "Legacy import: date recorded by legacy contract-corroboration; the exact read time was not recorded."
    }
  ],
  "lifecycle": "draft",
  "externalRefs": [
    {
      "system": "legacy-taxonomy-import",
      "id": "ade8a10bd7922765110a68986b0690eb3861f2e5:benchmarks/evaluation/domains/credential/assessment.ts",
      "url": "https://github.com/redact-secret/redact-secret-benchmarks/blob/ade8a10bd7922765110a68986b0690eb3861f2e5/benchmarks/evaluation/domains/credential/assessment.ts",
      "note": "cited by contracts['datadog-application-key'].corroboration"
    },
    {
      "system": "legacy-url",
      "id": "https://github.com/DataDog/terraform-module-datadog-agentless-scanner/blob/main/azure/arm/agentless-api-call.ps1",
      "note": "Legacy link names ref 'main', not a commit; it cannot be recorded as a GitHub file locator, so the locator is the repository and this is the exact legacy URL."
    }
  ],
  "notes": "Legacy URL pins ref 'main', which can move. Resolve it to a commit permalink before a reviewed claim depends on it."
}
