{
  "schemaVersion": 1,
  "kind": "evidence-source",
  "id": "docs-python-org-9c178ce981",
  "sourceType": "standard-or-rfc",
  "title": "Python Language Reference: Lexical analysis",
  "publisher": "docs.python.org",
  "publishedAt": null,
  "locator": {
    "url": "https://docs.python.org/3/reference/lexical_analysis.html",
    "pin": {
      "kind": "live-unpinned"
    }
  },
  "observations": [
    {
      "observedAt": "2026-10-03",
      "outcome": "read",
      "observer": "claude-research-agent"
    }
  ],
  "lifecycle": "draft"
}
