{
  "schemaVersion": 1,
  "kind": "evidence-source",
  "id": "docs-cloud-google-com-c7623e620f",
  "sourceType": "other",
  "title": "docs.cloud.google.com/docs/authentication/token-types",
  "publisher": "docs.cloud.google.com",
  "publishedAt": null,
  "locator": {
    "url": "https://docs.cloud.google.com/docs/authentication/token-types",
    "pin": {
      "kind": "live-unpinned"
    }
  },
  "observations": [
    {
      "observedAt": "2026-09-29",
      "outcome": "read",
      "observer": "legacy-import",
      "note": "Legacy import: date recorded by legacy dossier-research; the exact read time was not recorded."
    }
  ],
  "lifecycle": "draft",
  "externalRefs": [
    {
      "system": "legacy-taxonomy-import",
      "id": "1020d2b5905e8973098235e57c4cdca3359bba57:benchmarks/support/dossiers/google.md",
      "url": "https://github.com/redact-secret/redact-secret-benchmarks/blob/1020d2b5905e8973098235e57c4cdca3359bba57/benchmarks/support/dossiers/google.md",
      "note": "cited by families[id=google:oauth2-credential].research.sources"
    }
  ]
}
