{
  "schemaVersion": 1,
  "kind": "evidence-source",
  "id": "wiz-io-15cbaedd9e",
  "sourceType": "provider-documentation",
  "title": "www.wiz.io/blog/a-new-type-of-long-lived-key-on-aws-bedrock-api-keys",
  "publisher": "wiz.io",
  "publishedAt": null,
  "locator": {
    "url": "https://www.wiz.io/blog/a-new-type-of-long-lived-key-on-aws-bedrock-api-keys",
    "pin": {
      "kind": "live-unpinned"
    }
  },
  "observations": [
    {
      "observedAt": "2026-09-26",
      "outcome": "read",
      "observer": "legacy-import",
      "note": "Legacy import: date recorded by legacy contract-corroboration, contract-field; the exact read time was not recorded."
    }
  ],
  "lifecycle": "draft",
  "externalRefs": [
    {
      "system": "legacy-taxonomy-import",
      "id": "1020d2b5905e8973098235e57c4cdca3359bba57:benchmarks/lib/beta8/384b.ts",
      "url": "https://github.com/redact-secret/redact-secret-benchmarks/blob/1020d2b5905e8973098235e57c4cdca3359bba57/benchmarks/lib/beta8/384b.ts",
      "note": "cited by contracts['aws-bedrock-long-term-api-key'].corroboration; contracts['aws-bedrock-long-term-api-key'].fields; contracts['aws-bedrock-short-term-api-key'].fields"
    }
  ]
}
