{
  "schemaVersion": 1,
  "kind": "evidence-source",
  "id": "developer-spotify-com-a5fd0ccfe1",
  "sourceType": "provider-documentation",
  "title": "Apps",
  "publisher": "developer.spotify.com",
  "publishedAt": null,
  "locator": {
    "url": "https://developer.spotify.com/documentation/web-api/concepts/apps",
    "pin": {
      "kind": "live-unpinned"
    }
  },
  "observations": [
    {
      "observedAt": "2026-10-04",
      "outcome": "read",
      "observer": "research-agent"
    }
  ],
  "lifecycle": "draft"
}
