{
  "schemaVersion": 1,
  "kind": "evidence-source",
  "id": "github-com-redact-secret-redact-secret-178c5fc98f",
  "sourceType": "project-research-note",
  "title": "redact-secret/redact-secret @ 378581770a87751d72e27529796c4f790649fd00: docs/audits/evidence/1012/google-oauth2-credential.md",
  "publisher": "redact-secret/redact-secret",
  "publishedAt": null,
  "locator": {
    "url": "https://github.com/redact-secret/redact-secret/blob/378581770a87751d72e27529796c4f790649fd00/docs/audits/evidence/1012/google-oauth2-credential.md",
    "pin": {
      "kind": "commit-permalink",
      "commit": "378581770a87751d72e27529796c4f790649fd00"
    }
  },
  "observations": [
    {
      "observedAt": "2026-09-29",
      "outcome": "read",
      "observer": "legacy-import",
      "note": "Legacy import: date recorded by legacy dossier-evidence; the exact read time was not recorded."
    }
  ],
  "lifecycle": "draft",
  "externalRefs": [
    {
      "system": "legacy-taxonomy-import",
      "id": "1020d2b5905e8973098235e57c4cdca3359bba57:benchmarks/support/dossiers/google.md",
      "url": "https://github.com/redact-secret/redact-secret-benchmarks/blob/1020d2b5905e8973098235e57c4cdca3359bba57/benchmarks/support/dossiers/google.md",
      "note": "cited by families[id=google:oauth2-credential].research.evidence"
    }
  ]
}
