{
  "schemaVersion": 1,
  "kind": "evidence-source",
  "id": "github-com-trufflesecurity-trufflehog-327290882c",
  "sourceType": "scanner-rule-source",
  "title": "trufflesecurity/trufflehog @ v3.97.4: pkg/detectors/jwt/jwt.go",
  "publisher": "trufflesecurity/trufflehog",
  "publishedAt": null,
  "locator": {
    "url": "https://github.com/trufflesecurity/trufflehog",
    "pin": {
      "kind": "live-unpinned"
    }
  },
  "observations": [
    {
      "observedAt": "2026-09-17",
      "outcome": "read",
      "observer": "legacy-import",
      "note": "Legacy import: date recorded by legacy contract-corroboration; the exact read time was not recorded."
    }
  ],
  "lifecycle": "draft",
  "externalRefs": [
    {
      "system": "legacy-taxonomy-import",
      "id": "1020d2b5905e8973098235e57c4cdca3359bba57:benchmarks/evaluation/domains/credential/assessment.ts",
      "url": "https://github.com/redact-secret/redact-secret-benchmarks/blob/1020d2b5905e8973098235e57c4cdca3359bba57/benchmarks/evaluation/domains/credential/assessment.ts",
      "note": "cited by contracts['jwt'].corroboration"
    },
    {
      "system": "legacy-url",
      "id": "https://github.com/trufflesecurity/trufflehog/blob/v3.97.4/pkg/detectors/jwt/jwt.go",
      "note": "Legacy link names ref 'v3.97.4', not a commit; it cannot be recorded as a GitHub file locator, so the locator is the repository and this is the exact legacy URL."
    }
  ],
  "notes": "Legacy URL pins ref 'v3.97.4', which can move. Resolve it to a commit permalink before a reviewed claim depends on it."
}
