{
  "schemaVersion": 1,
  "kind": "evidence-source",
  "id": "github-com-redact-secret-redact-secret-9a8e9c56d4",
  "sourceType": "project-research-note",
  "title": "redact-secret/redact-secret @ 8b6a5fde52ecb4dfce13f09c7a947062d21483c7: docs/audits/evidence/367/README.md",
  "publisher": "redact-secret/redact-secret",
  "publishedAt": null,
  "locator": {
    "url": "https://github.com/redact-secret/redact-secret/blob/8b6a5fde52ecb4dfce13f09c7a947062d21483c7/docs/audits/evidence/367/README.md",
    "pin": {
      "kind": "commit-permalink",
      "commit": "8b6a5fde52ecb4dfce13f09c7a947062d21483c7"
    }
  },
  "observations": [
    {
      "observedAt": "2026-09-17",
      "outcome": "read",
      "observer": "legacy-import",
      "note": "Legacy import: date recorded by legacy dossier-evidence; the exact read time was not recorded."
    }
  ],
  "lifecycle": "draft",
  "externalRefs": [
    {
      "system": "legacy-taxonomy-import",
      "id": "ade8a10bd7922765110a68986b0690eb3861f2e5:benchmarks/support/dossiers/digitalocean.md",
      "url": "https://github.com/redact-secret/redact-secret-benchmarks/blob/ade8a10bd7922765110a68986b0690eb3861f2e5/benchmarks/support/dossiers/digitalocean.md",
      "note": "cited by families[id=digitalocean:oauth-token].research.evidence; families[id=digitalocean:personal-access-token].research.evidence; families[id=digitalocean:refresh-token].research.evidence"
    }
  ]
}
