{
  "schemaVersion": 1,
  "kind": "evidence-source",
  "id": "docs-newrelic-com-925733b4af",
  "sourceType": "provider-documentation",
  "title": "docs.newrelic.com/docs/ebpf/linux-installation/",
  "publisher": "docs.newrelic.com",
  "publishedAt": null,
  "locator": {
    "url": "https://docs.newrelic.com/docs/ebpf/linux-installation/",
    "pin": {
      "kind": "live-unpinned"
    }
  },
  "observations": [
    {
      "observedAt": "2026-09-23",
      "outcome": "read",
      "observer": "legacy-import",
      "note": "Legacy import: date recorded by legacy contract-reference; the exact read time was not recorded."
    },
    {
      "observedAt": "2026-09-24",
      "outcome": "read",
      "observer": "legacy-import",
      "note": "Legacy import: date recorded by legacy dossier-research; the exact read time was not recorded."
    }
  ],
  "lifecycle": "draft",
  "externalRefs": [
    {
      "system": "legacy-taxonomy-import",
      "id": "1020d2b5905e8973098235e57c4cdca3359bba57:benchmarks/evaluation/domains/credential/assessment.ts",
      "url": "https://github.com/redact-secret/redact-secret-benchmarks/blob/1020d2b5905e8973098235e57c4cdca3359bba57/benchmarks/evaluation/domains/credential/assessment.ts",
      "note": "cited by contracts['new-relic-license-key'].references"
    },
    {
      "system": "legacy-taxonomy-import",
      "id": "1020d2b5905e8973098235e57c4cdca3359bba57:benchmarks/support/dossiers/new-relic.md",
      "url": "https://github.com/redact-secret/redact-secret-benchmarks/blob/1020d2b5905e8973098235e57c4cdca3359bba57/benchmarks/support/dossiers/new-relic.md",
      "note": "cited by families[id=new-relic:license-key].research.sources"
    }
  ]
}
