{
  "schemaVersion": 1,
  "kind": "evidence-source",
  "id": "learning-postman-com-5a58f5b4a8",
  "sourceType": "provider-documentation",
  "title": "Postman Docs: Store and reuse values using variables",
  "publisher": "learning.postman.com",
  "publishedAt": null,
  "locator": {
    "url": "https://learning.postman.com/docs/use/send-requests/variables/variables/",
    "pin": {
      "kind": "live-unpinned"
    }
  },
  "observations": [
    {
      "observedAt": "2026-10-04",
      "outcome": "read",
      "observer": "research-agent"
    }
  ],
  "lifecycle": "draft"
}
