{
  "schemaVersion": 1,
  "kind": "evidence-source",
  "id": "google-aip-dev-e5e075818a",
  "sourceType": "provider-documentation",
  "title": "AIP-4112: Service Account Keys",
  "publisher": "google.aip.dev",
  "publishedAt": null,
  "locator": {
    "url": "https://google.aip.dev/auth/4112",
    "pin": {
      "kind": "live-unpinned"
    }
  },
  "observations": [
    {
      "observedAt": "2026-10-04",
      "outcome": "read",
      "observer": "research-agent"
    }
  ],
  "lifecycle": "draft"
}
