{
  "schemaVersion": 1,
  "kind": "evidence-source",
  "id": "help-mailgun-com-1fcd5f6cb8",
  "sourceType": "other",
  "title": "help.mailgun.com/hc/en-us/articles/203380100-Where-can-I-find-my-API-keys-and-SMTP-credentials",
  "publisher": "help.mailgun.com",
  "publishedAt": null,
  "locator": {
    "url": "https://help.mailgun.com/hc/en-us/articles/203380100-Where-can-I-find-my-API-keys-and-SMTP-credentials",
    "pin": {
      "kind": "live-unpinned"
    }
  },
  "observations": [
    {
      "observedAt": "2026-09-29",
      "outcome": "read",
      "observer": "legacy-import",
      "note": "Legacy import: date recorded by legacy dossier-research; the exact read time was not recorded."
    }
  ],
  "lifecycle": "draft",
  "externalRefs": [
    {
      "system": "legacy-taxonomy-import",
      "id": "ade8a10bd7922765110a68986b0690eb3861f2e5:benchmarks/support/dossiers/mailgun.md",
      "url": "https://github.com/redact-secret/redact-secret-benchmarks/blob/ade8a10bd7922765110a68986b0690eb3861f2e5/benchmarks/support/dossiers/mailgun.md",
      "note": "cited by families[id=mailgun:public-validation-key].research.sources"
    }
  ]
}
