{
  "schemaVersion": 1,
  "kind": "evidence-source",
  "id": "rfc-editor-org-7d2b98360d",
  "sourceType": "standard-or-rfc",
  "title": "RFC 4226: HOTP: An HMAC-Based One-Time Password Algorithm",
  "publisher": "rfc-editor.org",
  "publishedAt": null,
  "locator": {
    "url": "https://www.rfc-editor.org/rfc/rfc4226",
    "pin": {
      "kind": "live-unpinned"
    }
  },
  "observations": [
    {
      "observedAt": "2026-10-03",
      "outcome": "read",
      "observer": "research-agent",
      "contentDigest": "db6974cd02ca33560ec3a191ee9b1016067cd11d1f5d89e7efa36be69482229d"
    }
  ],
  "lifecycle": "draft"
}
