{
  "schemaVersion": 1,
  "kind": "evidence-source",
  "id": "vercel-com-8ba2d5b3b4",
  "sourceType": "provider-documentation",
  "title": "vercel.com/docs/accounts/access-tokens",
  "publisher": "vercel.com",
  "publishedAt": null,
  "locator": {
    "url": "https://vercel.com/docs/accounts/access-tokens",
    "pin": {
      "kind": "live-unpinned"
    }
  },
  "observations": [
    {
      "observedAt": "2026-09-20",
      "outcome": "read",
      "observer": "legacy-import",
      "note": "Legacy import: date recorded by legacy contract-candidateSource; the exact read time was not recorded."
    },
    {
      "observedAt": "2026-09-29",
      "outcome": "read",
      "observer": "legacy-import",
      "note": "Legacy import: date recorded by legacy contract-field, contract-reference, dossier-research, taxonomy-source; the exact read time was not recorded."
    },
    {
      "observedAt": "2026-10-03",
      "outcome": "changed",
      "observer": "research-agent",
      "contentDigest": "636924b355e559c940d0bc6847cda6d5f9de72eb148a8462c1662098bbfeda39",
      "note": "Re-read 2026-10-03: the page names only the vcp_ prefix (personal access tokens begin with vcp_) and a placeholder header example; it no longer contains the passage the contract claim candidate-source cites it for (opaque format, not intended to be human-readable, prefixes per credential type); that wording is now found on vercel.com/docs/sign-in-with-vercel/tokens for access and refresh tokens only. No body length or alphabet is stated."
    }
  ],
  "lifecycle": "draft",
  "externalRefs": [
    {
      "system": "legacy-taxonomy-import",
      "id": "1020d2b5905e8973098235e57c4cdca3359bba57:benchmarks/evaluation/domains/credential/assessment.ts",
      "url": "https://github.com/redact-secret/redact-secret-benchmarks/blob/1020d2b5905e8973098235e57c4cdca3359bba57/benchmarks/evaluation/domains/credential/assessment.ts",
      "note": "cited by contracts['vercel-token'].candidateSource"
    },
    {
      "system": "legacy-taxonomy-import",
      "id": "1020d2b5905e8973098235e57c4cdca3359bba57:benchmarks/lib/beta8/1012e.ts",
      "url": "https://github.com/redact-secret/redact-secret-benchmarks/blob/1020d2b5905e8973098235e57c4cdca3359bba57/benchmarks/lib/beta8/1012e.ts",
      "note": "cited by contracts['vercel-app-access-token'].references; contracts['vercel-app-refresh-token'].references; contracts['vercel-personal-access-token'].fields; contracts['vercel-personal-access-token'].references"
    },
    {
      "system": "legacy-taxonomy-import",
      "id": "1020d2b5905e8973098235e57c4cdca3359bba57:benchmarks/support/dossiers/vercel.md",
      "url": "https://github.com/redact-secret/redact-secret-benchmarks/blob/1020d2b5905e8973098235e57c4cdca3359bba57/benchmarks/support/dossiers/vercel.md",
      "note": "cited by families[id=vercel:personal-access-token].research.sources"
    },
    {
      "system": "legacy-taxonomy-import",
      "id": "1020d2b5905e8973098235e57c4cdca3359bba57:benchmarks/support/taxonomy.json",
      "url": "https://github.com/redact-secret/redact-secret-benchmarks/blob/1020d2b5905e8973098235e57c4cdca3359bba57/benchmarks/support/taxonomy.json",
      "note": "cited by families[id=vercel:personal-access-token].sources"
    }
  ]
}
