{
  "schemaVersion": 1,
  "kind": "evidence-source",
  "id": "github-com-get-convex-convex-backend-e6ddb40861",
  "sourceType": "other",
  "title": "get-convex/convex-backend @ 032e81e264a8b23b8d566d8f83f773d2bfbedb88",
  "publisher": "get-convex/convex-backend",
  "publishedAt": null,
  "locator": {
    "url": "https://github.com/get-convex/convex-backend/tree/032e81e264a8b23b8d566d8f83f773d2bfbedb88",
    "pin": {
      "kind": "commit-permalink",
      "commit": "032e81e264a8b23b8d566d8f83f773d2bfbedb88"
    }
  },
  "observations": [
    {
      "observedAt": "2026-09-28",
      "outcome": "read",
      "observer": "legacy-import",
      "note": "Legacy import: date recorded by legacy contract-reference, dossier-research; the exact read time was not recorded."
    }
  ],
  "lifecycle": "draft",
  "externalRefs": [
    {
      "system": "legacy-taxonomy-import",
      "id": "1020d2b5905e8973098235e57c4cdca3359bba57:benchmarks/lib/beta8/436a.ts",
      "url": "https://github.com/redact-secret/redact-secret-benchmarks/blob/1020d2b5905e8973098235e57c4cdca3359bba57/benchmarks/lib/beta8/436a.ts",
      "note": "cited by contracts['convex-deployment-key'].references"
    },
    {
      "system": "legacy-taxonomy-import",
      "id": "1020d2b5905e8973098235e57c4cdca3359bba57:benchmarks/support/dossiers/convex.md",
      "url": "https://github.com/redact-secret/redact-secret-benchmarks/blob/1020d2b5905e8973098235e57c4cdca3359bba57/benchmarks/support/dossiers/convex.md",
      "note": "cited by families[id=convex:deployment-key].research.sources"
    }
  ]
}
