{
  "schemaVersion": 1,
  "kind": "evidence-source",
  "id": "github-com-praetorian-inc-noseyparker-1a28b5a97c",
  "sourceType": "scanner-rule-source",
  "title": "praetorian-inc/noseyparker @ main: crates/noseyparker/data/default/builtin/rules/github.yml",
  "publisher": "praetorian-inc/noseyparker",
  "publishedAt": null,
  "locator": {
    "url": "https://github.com/praetorian-inc/noseyparker",
    "pin": {
      "kind": "live-unpinned"
    }
  },
  "observations": [
    {
      "observedAt": "2026-09-24",
      "outcome": "read",
      "observer": "legacy-import",
      "note": "Legacy import: date recorded by legacy contract-corroboration, contract-field; the exact read time was not recorded."
    }
  ],
  "lifecycle": "draft",
  "externalRefs": [
    {
      "system": "legacy-taxonomy-import",
      "id": "ade8a10bd7922765110a68986b0690eb3861f2e5:benchmarks/lib/beta8/211.ts",
      "url": "https://github.com/redact-secret/redact-secret-benchmarks/blob/ade8a10bd7922765110a68986b0690eb3861f2e5/benchmarks/lib/beta8/211.ts",
      "note": "cited by contracts['github-fine-grained-pat'].corroboration; contracts['github-fine-grained-pat'].fields"
    },
    {
      "system": "legacy-url",
      "id": "https://github.com/praetorian-inc/noseyparker/blob/main/crates/noseyparker/data/default/builtin/rules/github.yml",
      "note": "Legacy link names ref 'main', not a commit; it cannot be recorded as a GitHub file locator, so the locator is the repository and this is the exact legacy URL."
    }
  ],
  "notes": "Legacy URL pins ref 'main', which can move. Resolve it to a commit permalink before a reviewed claim depends on it."
}
