{
  "schemaVersion": 1,
  "kind": "evidence-source",
  "id": "tc39-es-80655998e0",
  "sourceType": "standard-or-rfc",
  "title": "ECMAScript Language Specification",
  "publisher": "tc39.es",
  "publishedAt": null,
  "locator": {
    "url": "https://tc39.es/ecma262/",
    "pin": {
      "kind": "live-unpinned"
    }
  },
  "observations": [
    {
      "observedAt": "2026-10-03",
      "outcome": "read",
      "observer": "claude-research-agent"
    }
  ],
  "lifecycle": "draft"
}
