{
  "schemaVersion": 1,
  "kind": "evidence-source",
  "id": "github-com-redact-secret-redact-secret-c1cd0bb447",
  "sourceType": "issue-or-discussion",
  "title": "github.com/redact-secret/redact-secret/issues/789",
  "publisher": "redact-secret/redact-secret",
  "publishedAt": null,
  "locator": {
    "url": "https://github.com/redact-secret/redact-secret/issues/789",
    "pin": {
      "kind": "live-unpinned"
    }
  },
  "observations": [
    {
      "observedAt": "2026-09-26",
      "outcome": "read",
      "observer": "legacy-import",
      "note": "Legacy import: date recorded by legacy contract-reference; the exact read time was not recorded."
    }
  ],
  "lifecycle": "draft",
  "externalRefs": [
    {
      "system": "legacy-taxonomy-import",
      "id": "ade8a10bd7922765110a68986b0690eb3861f2e5:benchmarks/lib/beta8/384e.ts",
      "url": "https://github.com/redact-secret/redact-secret-benchmarks/blob/ade8a10bd7922765110a68986b0690eb3861f2e5/benchmarks/lib/beta8/384e.ts",
      "note": "cited by contracts['deepgram-api-key'].references"
    }
  ]
}
