{
  "schemaVersion": 1,
  "kind": "evidence-source",
  "id": "github-com-redact-secret-redact-secret-4c97a62c02",
  "sourceType": "project-research-note",
  "title": "redact-secret/redact-secret @ 54c9ab35cb693e0cd3aedc8f858ca19ab77e4363: docs/decisions/2026-09-20-inventory-gitlab-token-families.md",
  "publisher": "redact-secret/redact-secret",
  "publishedAt": null,
  "locator": {
    "url": "https://github.com/redact-secret/redact-secret/blob/54c9ab35cb693e0cd3aedc8f858ca19ab77e4363/docs/decisions/2026-09-20-inventory-gitlab-token-families.md",
    "pin": {
      "kind": "commit-permalink",
      "commit": "54c9ab35cb693e0cd3aedc8f858ca19ab77e4363"
    }
  },
  "observations": [
    {
      "observedAt": "2026-09-20",
      "outcome": "read",
      "observer": "legacy-import",
      "note": "Legacy import: date recorded by legacy dossier-evidence; the exact read time was not recorded."
    }
  ],
  "lifecycle": "draft",
  "externalRefs": [
    {
      "system": "legacy-taxonomy-import",
      "id": "ade8a10bd7922765110a68986b0690eb3861f2e5:benchmarks/support/dossiers/gitlab.md",
      "url": "https://github.com/redact-secret/redact-secret-benchmarks/blob/ade8a10bd7922765110a68986b0690eb3861f2e5/benchmarks/support/dossiers/gitlab.md",
      "note": "cited by families[id=gitlab:legacy-personal-access-token].research.evidence"
    }
  ]
}
