{
  "schemaVersion": 1,
  "kind": "evidence-source",
  "id": "github-com-redact-secret-redact-secret-f8cda0acf9",
  "sourceType": "scanner-rule-source",
  "title": "redact-secret/redact-secret @ add1188fed9993723c59fbce8c867086b9d2049a: docs/audits/evidence/1013/openai-admin-api-key.md",
  "publisher": "redact-secret/redact-secret",
  "publishedAt": null,
  "locator": {
    "url": "https://github.com/redact-secret/redact-secret/blob/add1188fed9993723c59fbce8c867086b9d2049a/docs/audits/evidence/1013/openai-admin-api-key.md",
    "pin": {
      "kind": "commit-permalink",
      "commit": "add1188fed9993723c59fbce8c867086b9d2049a"
    }
  },
  "observations": [
    {
      "observedAt": "2026-09-26",
      "outcome": "read",
      "observer": "legacy-import",
      "note": "Legacy import: date recorded by legacy contract-field, contract-reference; the exact read time was not recorded."
    },
    {
      "observedAt": "2026-09-29",
      "outcome": "read",
      "observer": "legacy-import",
      "note": "Legacy import: date recorded by legacy dossier-evidence; the exact read time was not recorded."
    }
  ],
  "lifecycle": "draft",
  "externalRefs": [
    {
      "system": "legacy-taxonomy-import",
      "id": "ade8a10bd7922765110a68986b0690eb3861f2e5:benchmarks/lib/beta8/384a.ts",
      "url": "https://github.com/redact-secret/redact-secret-benchmarks/blob/ade8a10bd7922765110a68986b0690eb3861f2e5/benchmarks/lib/beta8/384a.ts",
      "note": "cited by contracts['openai-admin-api-key'].fields; contracts['openai-admin-api-key'].references"
    },
    {
      "system": "legacy-taxonomy-import",
      "id": "ade8a10bd7922765110a68986b0690eb3861f2e5:benchmarks/support/dossiers/openai.md",
      "url": "https://github.com/redact-secret/redact-secret-benchmarks/blob/ade8a10bd7922765110a68986b0690eb3861f2e5/benchmarks/support/dossiers/openai.md",
      "note": "cited by families[id=openai:admin-api-key].research.evidence"
    }
  ]
}
