{
  "schemaVersion": 1,
  "kind": "evidence-source",
  "id": "github-com-berriai-litellm-b23fc78a80",
  "sourceType": "provider-documentation",
  "title": "github.com/BerriAI/litellm/issues/9291",
  "publisher": "BerriAI/litellm",
  "publishedAt": null,
  "locator": {
    "url": "https://github.com/BerriAI/litellm/issues/9291",
    "pin": {
      "kind": "live-unpinned"
    }
  },
  "observations": [
    {
      "observedAt": "2026-09-24",
      "outcome": "read",
      "observer": "legacy-import",
      "note": "Legacy import: date recorded by legacy contract-field, contract-reference; the exact read time was not recorded."
    }
  ],
  "lifecycle": "draft",
  "externalRefs": [
    {
      "system": "legacy-taxonomy-import",
      "id": "ade8a10bd7922765110a68986b0690eb3861f2e5:benchmarks/lib/beta8/208.ts",
      "url": "https://github.com/redact-secret/redact-secret-benchmarks/blob/ade8a10bd7922765110a68986b0690eb3861f2e5/benchmarks/lib/beta8/208.ts",
      "note": "cited by contracts['xai-api-key'].fields; contracts['xai-api-key'].references"
    }
  ]
}
